{
  "schema_version": "1.0",
  "contract_id": "derived-offset-time",
  "objective": "Compute the elapsed whole minutes respecting both UTC offsets. Return no claims, evidence or actions.",
  "inputs": {
    "start": "2026-12-03T22:50:00-03:00",
    "end": "2026-12-04T02:35:00Z",
    "result_spec": {
      "required_keys": [
        "minutes"
      ],
      "additional_keys": false,
      "types": {
        "minutes": "integer"
      }
    },
    "semantic_assertions": [
      {
        "assertion_id": "offset-time.minutes",
        "operator": "equals",
        "left": {
          "op": "ref",
          "source": "result",
          "pointer": "/minutes"
        },
        "right": {
          "op": "duration_minutes",
          "args": [
            {
              "op": "ref",
              "source": "inputs",
              "pointer": "/start"
            },
            {
              "op": "ref",
              "source": "inputs",
              "pointer": "/end"
            }
          ]
        }
      }
    ]
  },
  "acceptance_criteria": [
    {
      "criterion_id": "derived-values",
      "description": "Every result field must satisfy its visible input-derived formula.",
      "required_evidence": []
    }
  ],
  "allowed_actions": [],
  "forbidden_actions": [
    "shell.execute",
    "external.publish"
  ],
  "risk_level": "low",
  "max_attempts": 2,
  "requires_human_approval": false
}
